{
  "$schema": "./variant.schema.json",
  "id": "month-06-badi",
  "kind": "month",
  "name": "Badi",
  "enabled": true,
  "valid": {
    "month": 6,
    "from": "06-15",
    "to": "06-30"
  },
  "palette": {
    "component.appIcon.bgFrom": "{primitive.color.sky.200}",
    "component.appIcon.bgTo": "{primitive.color.sky.200}",
    "component.appIcon.bgRim": "{primitive.color.sky.400}"
  },
  "accessories": [
    "swimRing"
  ],
  "background": [
    "waves"
  ],
  "note": "Schwimmring, Wellen — Badi-Saison"
}
