{
  "$schema": "./variant.schema.json",
  "id": "month-11-raebeliechtli",
  "kind": "month",
  "name": "Räbeliechtli",
  "enabled": true,
  "valid": {
    "month": 11,
    "from": "11-01",
    "to": "11-15"
  },
  "palette": {
    "component.appIcon.bgFrom": "{primitive.color.sky.600}",
    "component.appIcon.bgTo": "{primitive.color.violet.700}",
    "component.appIcon.bgRim": "{primitive.color.cocoa.900}",
    "component.splash.bg": "{primitive.color.violet.700}",
    "component.splash.wordmark": "{primitive.color.white}",
    "component.splash.wordmarkDepth": "{primitive.color.pink.600}"
  },
  "accessories": [
    "lantern"
  ],
  "background": [
    "stars"
  ],
  "note": "Räben-Laterne, Sternenhimmel — Schweizer Räbeliechtli-Umzug"
}
